{
  "schema_version": 1,
  "kind": "BusinessKnowledgeCoverageLedger",
  "id": "BKL-READER-PROGRESS-READ-DURATION-SESSION-001",
  "revision": 1,
  "status": "current",
  "packet_refs": [
    {
      "id": "BKP-READER-PROGRESS-READ-DURATION-SESSION-001",
      "revision": 1,
      "sha256": "e3a10870cb278cb86e427bc58c36c19df0e200d01efad6111ba6a9faab076484"
    }
  ],
  "generated_from": {
    "knowledge_authority_sha256": "c903b4c3224e2b553a51fa181f0c31ca0a39b254d8def0a316d2e97d29ea3097",
    "requirement_catalog_sha256": "2de1e193755031763bb49d7e228345114aa09c12c33f4feb5afa090629c94d83",
    "architecture_digest_sha256": "fa6ab6cd2f4142848847c17a03d761e4cd4705a39babdf82bec3efa68ab4be9a"
  },
  "entries": [
    {
      "id": "BKE-READER-SESSION-STATE-001",
      "claim_ref": {
        "id": "BKC-RD-SESSION-STATE-001",
        "revision": 2
      },
      "validation": {
        "required": "android_runtime",
        "state": "verified",
        "evidence_refs": [
          "ios/harness/goldens/releases/rl-reader-progress-read-duration-session-001-30508423902-1.json",
          "ios/harness/goldens/android-legado-v1/rl-reader-progress-read-duration-session-001.json#/artifact/result/value/portable_known_projection"
        ],
        "blockers": []
      },
      "product_disposition": {
        "kind": "covered_by_requirement",
        "refs": [
          "REQ-ANDROID-MIGRATION-CHARACTERIZATION-001@1#RC-01"
        ],
        "reason": "当前 Requirement 只闭环 Android 进程级共享会话与迟到 executor 任务的知识，不批准复制 Android 全局 ReadBook object。该证据约束后续 ReaderCore 使用显式 session identity/generation、不可变结算命令和迟到结果拒绝策略。",
        "review_after": null
      },
      "delivery": {
        "state": "planned",
        "requirement_refs": [
          "REQ-ANDROID-MIGRATION-CHARACTERIZATION-001@1#RC-01"
        ],
        "work_item_refs": [
          "IOS-CHARACTERIZE-READER-PROGRESS-READ-DURATION-SESSION-001"
        ],
        "capability_refs": [
          "CAP-CONFORMANCE",
          "CAP-CORE"
        ],
        "evidence_refs": [
          "ios/harness/goldens/releases/rl-reader-progress-read-duration-session-001-30508423902-1.json"
        ]
      },
      "computed": {
        "accounted": true,
        "coverage_state": "covered"
      }
    },
    {
      "id": "BKE-READER-PROGRESS-READ-DURATION-SESSION-001",
      "claim_ref": {
        "id": "BKC-RD-READ-RECORD-001",
        "revision": 2
      },
      "validation": {
        "required": "android_runtime",
        "state": "verified",
        "evidence_refs": [
          "ios/harness/goldens/releases/rl-reader-progress-read-duration-session-001-30508423902-1.json",
          "ios/harness/goldens/android-legado-v1/rl-reader-progress-read-duration-session-001.json#/artifact/result/value/portable_known_projection",
          "ios/harness/goldens/releases/rl-reader-history-read-record-runtime-risk-001-30469890402-1.json"
        ],
        "blockers": []
      },
      "product_disposition": {
        "kind": "covered_by_requirement",
        "refs": [
          "REQ-ANDROID-MIGRATION-CHARACTERIZATION-001@1#RC-01"
        ],
        "reason": "当前 Requirement 覆盖连续结算、记录开关、执行时配置读取、异步持久化窗口和切书串账的 Android 事实闭环，不表示 iOS 要保留这些竞态。后续 ReaderCore Requirement 应采用单调时钟、显式生命周期结算、session generation 与幂等存储端口；本任务不新增产品实现、架构依赖边或第三方库。",
        "review_after": null
      },
      "delivery": {
        "state": "planned",
        "requirement_refs": [
          "REQ-ANDROID-MIGRATION-CHARACTERIZATION-001@1#RC-01"
        ],
        "work_item_refs": [
          "IOS-CHARACTERIZE-READER-PROGRESS-READ-DURATION-SESSION-001"
        ],
        "capability_refs": [
          "CAP-CONFORMANCE",
          "CAP-CORE"
        ],
        "evidence_refs": [
          "ios/harness/goldens/releases/rl-reader-progress-read-duration-session-001-30508423902-1.json",
          "ios/harness/goldens/releases/rl-reader-history-read-record-runtime-risk-001-30469890402-1.json"
        ]
      },
      "computed": {
        "accounted": true,
        "coverage_state": "covered"
      }
    }
  ],
  "updated_by": "IOS-CHARACTERIZE-READER-PROGRESS-READ-DURATION-SESSION-001",
  "updated_at": "2026-07-30T02:40:26Z"
}
