{
  "schema_version": 1,
  "kind": "BusinessKnowledgeCoverageLedger",
  "id": "BKL-READER-CACHE-OFFLINE-QUEUE-001",
  "revision": 1,
  "status": "current",
  "packet_refs": [
    {
      "id": "BKP-READER-CACHE-OFFLINE-QUEUE-001",
      "revision": 1,
      "sha256": "9f4c60645fc150e3ce30ecf8e48d1b1df47f590ae7cd908d70b3aa1ea43bac49"
    }
  ],
  "generated_from": {
    "knowledge_authority_sha256": "393519a8689f2976bc329d93f0940007a37f4149ed803a7bb8c948e899f93bfc",
    "requirement_catalog_sha256": "f100b26e1c2ac6b3a3f2e990bda10943034043eba1aeecb689918d855b5780f6",
    "architecture_digest_sha256": "fa6ab6cd2f4142848847c17a03d761e4cd4705a39babdf82bec3efa68ab4be9a"
  },
  "entries": [
    {
      "id": "BKE-READER-CACHE-OFFLINE-QUEUE-001",
      "claim_ref": {
        "id": "BKC-RD-OFFLINE-CACHE-QUEUE-001",
        "revision": 2
      },
      "validation": {
        "required": "android_runtime",
        "state": "verified",
        "evidence_refs": [
          "ios/harness/goldens/releases/rl-reader-cache-offline-queue-001-30845332612-1.json",
          "ios/harness/goldens/android-legado-v1/rl-reader-cache-offline-queue-001.json#/artifact/result/value"
        ],
        "blockers": []
      },
      "product_disposition": {
        "kind": "covered_by_requirement",
        "refs": [
          "REQ-ANDROID-MIGRATION-CHARACTERIZATION-001@1#RC-01"
        ],
        "reason": "受保护 Android Golden 已冻结离线缓存队列的聚合统计、clear/close 生命周期、三次普通失败预算、ConcurrentException 与 stop 重排语义，交由 ReaderCore 状态机和 AppUseCases 执行端口实现",
        "review_after": null
      },
      "delivery": {
        "state": "planned",
        "requirement_refs": [
          "REQ-ANDROID-MIGRATION-CHARACTERIZATION-001@1#RC-01"
        ],
        "work_item_refs": [
          "IOS-READER-CORE-CACHE-OFFLINE-QUEUE-001"
        ],
        "capability_refs": [
          "CAP-CONFORMANCE",
          "CAP-CORE"
        ],
        "evidence_refs": [
          "ios/harness/goldens/releases/rl-reader-cache-offline-queue-001-30845332612-1.json"
        ]
      },
      "computed": {
        "accounted": true,
        "coverage_state": "covered"
      }
    }
  ],
  "updated_by": "IOS-CHARACTERIZE-READER-CACHE-OFFLINE-QUEUE-001",
  "updated_at": "2026-08-03T19:35:23Z"
}
